{
	"map_name": "Prague-Class Independent Research Vessel",
	"map_short_name": "Prague-Class",
	"map_path": "_maps/shuttles/shiptest/golem_ship.dmm",
	"map_id": "golem_ship",
	"job_slots": {
		"Captain": 1,
		"Head of Personnel": 1,
		"Medical Doctor": 2,
		"Station Engineer": 3,
		"Shaft Miner": 2,
		"Cargo Technician": 2,
		"Security Officer": 1,
		"Assistant": 5
	}
}
