{
	"map_name": "Luxembourg-class Delivery Vessel",
	"map_short_name": "Luxembourg-class",
	"map_path": "_maps/shuttles/shiptest/syndicate_luxembourg.dmm",
	"map_id": "syndicate_luxembourg",
	"job_slots": {
		"Quartermaster": 1,
		"Cargo Technician": 2,
		"Station Engineer": 1,
		"Assistant": 3,
		"Bartender": 1,
		"Medical Doctor": 1
	},
	"cost": 600
}
	