{
	"map_name": "High-class corporate luxury ship",
	"map_short_name": "High-class",
	"map_path": "_maps/shuttles/shiptest/corp_high.dmm",
	"map_id": "corp_high",
	"job_slots": {
		"Captain": 1,
		"Security Officer": 2,
		"Station Engineer": 1,
		"Shaft Miner": 1,
		"Assistant": 4
	},
	"cost": 850
}
