{	"$schema": "https://raw.githubusercontent.com/shiptest-ss13/Shiptest/master/_maps/ship_config_schema.json",
	"prefix": "SSV",
	"namelists": ["GENERAL", "NATURAL_AGGRESSIVE", "BEASTS", "WEAPONS"],
	"map_name": "Hyena-class Wrecking Tug",
	"map_short_name": "Hyena-class",
	"map_path": "_maps/shuttles/shiptest/gorlex_hyena.dmm",
	"map_id": "gorlex_hyena",
	"job_slots": {
		"Captain": {
			"outfit": "/datum/outfit/job/captain/syndicate/gorlex",
			"officer": true,
			"slots": 1
		},
		"Foreman": {
			"outfit": "/datum/outfit/job/ce/syndicate/gorlex",
			"officer": true,
			"slots": 1
		},
		"Mechanic": {
			"outfit": "/datum/outfit/job/engineer/syndicate/gorlex",
			"slots": 1
		},
		"Wrecker": {
			"outfit": "/datum/outfit/job/miner/syndicate",
			"slots": 2
		},
		"Junior Agent": {
			"outfit": "/datum/outfit/job/assistant/syndicate/gorlex",
			"slots": 2
		}
	},
	"cost": 750
}
