{
	"$schema": "https://raw.githubusercontent.com/ZetaSingularity/Shiptest/master/_maps/ship_config_schema.json",
	"map_name": "Halftrack-Class Merchant Vessel",
	"prefix": "ISV",
	"namelists": ["MERCANTILE", "WEAPONS"],
	"map_short_name": "Halftrack-Class",
	"map_path": "_maps/shuttles/shiptest/independent_halftrack.dmm",
	"cost": 0,
	"job_slots": {
		"Captain": 1,
		"IRMG Vanguard": {
			"outfit": "/datum/outfit/job/captain/inteq",
			"officer": true,
			"slots": 1
		},
		"IRMG Enforcer": {
			"outfit": "/datum/outfit/job/security/inteq",
			"slots": 2
		}
	}
}
