{
	"map_name": "Raven-class Heavy Transporter",
	"map_short_name": "Raven-class",
	"map_path": "_maps/shuttles/shiptest/nanotrasen_raven.dmm",
	"map_id": "nanotrasen_raven",
	"job_slots": {
		"Captain": 1,
		"Head of Security": 1,
		"Chief Medical Officer": 1,
		"Head Of Personnel": 1,
		"Chief Engineer": 1,
		"Station Engineer": 1,
		"Security Officer": 1,
		"Shaft Miner": 1,
		"Medical Doctor": 1,
		"Cargo Technician": 1,
		"Assistant": 3
	},
	"cost": 650
}
	