{
	"map_name": "Kilo-class Mining Ship",
	"prefix": "SV",
	"namelists": ["GENERAL", "SPACE", "NATURAL", "NATURAL_AGGRESSIVE"],
	"map_short_name": "Kilo-class",
	"map_path": "_maps/shuttles/shiptest/whiteship_kilo.dmm",
	"map_id": "whiteship_kilo",
	"job_slots": {
		"Captain": {
			"outfit": "/datum/outfit/job/captain/western",
			"officer": true,
			"slots": 1
		},
		"Foreman": {
			"outfit": "/datum/outfit/job/quartermaster/western",
			"slots": 1
			},
		"Ship's Doctor": {
			"outfit": "/datum/outfit/job/doctor",
			"slots": 1
			},
		"Ship's Engineer": {
			"outfit": "/datum/outfit/job/engineer/hazard",
			"slots": 1
		},
		"Asteroid Miner": {
			"outfit": "/datum/outfit/job/miner/hazard",
			"slots": 2
		},
		"Deckhand": {
			"outfit": "/datum/outfit/job/assistant",
			"slots": 2
		}
	},
	"cost": 500
}
