{
	"map_name": "Liberty-class Interceptor",
	"map_short_name": "Liberty-class",
	"map_path": "_maps/shuttles/shiptest/solgov_liberty.dmm",
	"map_id": "liberty",
	"job_slots": {
		"Captain": 1,
		"Head of Personnel": 1,
		"Security Officer": 2,
		"Warden": 1,
		"Brig Physician": 1,
		"Staff Assistant": 4
	}
}
