{
	"map_name": "Scrapper-Class Salvage Cruiser",
	"map_short_name": "Scrapper",
	"map_path": "_maps/shuttles/shiptest/scrapper.dmm",
	"map_id": "scrapper",
	"job_slots": {
		"Captain": 1,
		"Head of Personnel": 1,
		"Medical Doctor": 4,
		"Station Engineer": 3,
		"Shaft Miner": 3,
		"Security Officer": 2,
		"Assistant": 7,
		"Botanist": 1
	},
	"cost": 750
}
