{
	"map_name": "Delta-class Frigate",
	"map_short_name": "Delta-class",
	"map_path": "_maps/shuttles/whiteship_delta.dmm",
	"map_id": "whiteship_delta",
	"job_slots": {
		"Captain": 1,
		"Quartermaster": 1,
		"Medical Doctor": 1,
		"Station Engineer": 1,
		"Shaft Miner": 1,
		"Assistant": 3
	},
	"cost": 500
}
