{
	"map_name": "Goon-class Repurposed Emergency Shuttle",
	"map_short_name": "Goon-class",
	"map_path": "_maps/shuttles/shiptest/nanotrasen_goon.dmm",
	"map_id": "nanotrasen_goon",
	"job_slots": {
		"Captain": 1,
		"Shaft Miner": 1,
		"Station Engineer": 1,
		"Medical Doctor": 1,
		"Assistant": 3
	},
	"cost": 300
}
	