{
	"map_name": "Shetland-class Multipurpose Frigate",
	"map_short_name": "Shetland-class",
	"map_path": "_maps/shuttles/amogus_sus.dmm",
	"map_id": "amogus_sus",
	"roundstart": true,
	"job_slots": {
		"Captain": 1,
		"SolGov Representative": 1,
		"Head of Personnel": 1,
		"Medical Doctor": 2,
		"Station Engineer": 3,
		"Shaft Miner": 2,
		"Cargo Technician": 2,
		"Security Officer": 1,
		"Assistant": 5
	},
	"cost": 750
}
