{
	"map_name": "Pubby-class Light Carrier",
	"map_short_name": "Punny-class",
	"map_path": "_maps/shuttles/whiteship/whiteship_pubby.dmm",
	"map_id": "whiteship_pubby",
	"job_slots": {
		"Captain": 1,
		"Quartermaster": 1,
		"Medical Doctor": 1,
		"Station Engineer": 1,
		"Shaft Miner": 2,
		"Assistant": 2
	},
	"cost": 500
}
