{
	"map_name": "Statio.3-class Station With Thrusters",
	"map_short_name": "Statio.3-class",
	"map_path": "_maps/shuttles/shiptest/nanotrasen_station.dmm",
	"map_id": "nanotrasen_station",
	"job_slots": {
		"Captain": 1,
		"Head of Personnel": 1,
		"Chief Engineer": 1,
		"Chief Medical Officer": 1,
		"Research Director": 1,
		"Head of Security": 1,
		"Solgov Representative": 1,
		"Station Engineer": 4,
		"Atmospheric Technician": 2,
		"Medical Doctor": 4,
		"Paramedic": 1,
		"Virologist": 1,
		"Chemist": 1,
		"Scientist": 4,
		"Roboticist": 2,
		"Quartermaster": 1,
		"Cargo Technician": 3,
		"Shaft Miner": 2,
		"Bartender": 1,
		"Cook": 1,
		"Botanist": 2,
		"Janitor": 1,
		"Chaplain": 1,
		"Clown": 1,
		"Mime": 1,
		"Warden": 1,
		"Detective": 1,
		"Brig Physician": 1,
		"Security Officer": 4,
		"Cyborg": 2,
		"Assistant": 30
	},
	"cost": 100000
}
