{
	"map_name": "Tranquility-class Flying Apartment Complex",
	"prefix": "ISV",
	"namelists": ["GENERAL", "SPACE", "NATURAL"],
	"map_short_name": "Tranquility-class",
	"map_path": "_maps/shuttles/shiptest/tranq.dmm",
	"map_id": "tranq",
	"job_slots": {
		"Captain": {
			"outfit": "/datum/outfit/job/captain/western",
			"officer": true,
			"slots": 1
		},
		"Scholar": {
			"outfit": "/datum/outfit/job/curator/librarian",
			"slots": 1
		},
		"Medical Tenant": {
			"outfit": "/datum/outfit/job/chemist/pharmacologist",
			"slots": 1
		},
		"Engineering Tenant": {
			"outfit": "/datum/outfit/job/engineer/electrician",
			"slots": 1
		},
		"Tenant": {
			"outfit": "/datum/outfit/job/curator/dungeonmaster",
			"slots": 1
		},
		"Resident Artist": {
			"outfit": "/datum/outfit/job/assistant/artist",
			"slots": 1
		}
	},
	"cost": 1000
}
