{
	"map_name": "Courage-class Strike Dropship",
	"map_short_name": "Courage-class",
	"prefix": "SYN-C",
	"map_path": "_maps/shuttles/shiptest/courage.dmm",
	"map_id": "courage_class",
	"job_slots": {
		"Syndicate Strike Captain": {
			"outfit": "/datum/outfit/syndicate_empty/sbc/assault/captain",
			"officer": true,
			"slots": 1
		},
		"Syndicate Marine":{
			"outfit": "/datum/outfit/syndicate_empty/sbc/assault",
			"slots": 3
		}
	},
	"cost": 750
}
