{
	"map_name": "Meta-class Freighter",
	"map_short_name": "Meta-class",
	"map_path": "_maps/shuttles/whiteship_meta.dmm",
	"map_id": "whiteship_meta",
	"job_slots": {
		"Captain": 1,
		"Quartermaster": 1,
		"Medical Doctor": 1,
		"Station Engineer": 1,
		"Shaft Miner": 1,
		"Assistant": 3
	},
	"cost": 500
}
