{
	"map_name": "Spitfire-class Search and Rescue Vessel",
	"map_short_name": "Spitfire-class",
	"map_path": "_maps/shuttles/shiptest/syndicate_spitfire.dmm",
	"map_id": "syndicate_spitfire",
	"job_slots": {
		"Chief Medical Officer": 1,
		"Medical Doctor": 1,
		"Paramedic": 1,
		"Station Engineer": 1,
		"Shaft Miner": 1,
		"Assistant": 1
	},
	"cost": 350
}
	