{
	"map_name": "Cricket-Class Solgov Intel Scout",
	"map_short_name": "Solgov Cricket",
	"map_path": "_maps/shuttles/shiptest/solgov_cricket.dmm",
	"map_id" : "solgov_cricket",
	"job_slots": {
		"Captain": 1,
		"SolGov Representative": 1,
		"Chemist": 1,
		"Station Engineer": 2,
		"Shaft Miner": 2,
		"Cargo Technician": 1,
		"Security Officer": 1,
		"Cook": 1,
		"Assistant": 3
	},
	"cost": 780
}
